"","title","author","subject","abstract","meta"
"34","Modulation of 2-Point Discrimination Threshold Under Chemically Induced Global Stimulation","Junjie Hua, Masahiro Furukawa, Taro Maeda","Neurons and Cognition (q-bio.NC)","The two-point discrimination threshold(2PDT) serves as a critical indicator in the study of tactile acuity, representing the minimal distance at which an individual can differentiate two distinct points of contact on the skin. This measurement is instrumental in exploring the neural mechanisms underlying tactile perception. On the other hand, tactile acuity can be modulated by global stimulation. Prior research indicates that experimental inflammation induced by an application of capsaicin cream increases2PDT. In our study, we applied chemicals(oregano, menthol, and Sichuan pepper) to selectively activate receptors that usually respond to mild physical stimuli to investigate their influence on2PDT without inducing inflammation. The results unveiled a pronounced augmentation of2PDT following any form of global stimulation. Intriguingly, the cumulative effect of the chemical mix on2PDT appeared to be additive. These observations suggest that Wide Dynamic Range(WDR) neurons, functioning as relay nuclei with projections for touch, warmth, and cold sensations, play a pivotal role in this process. In lateral connection structures parallel to afferent nerve transmission pathways with WDR neurons as relay nuclei, global stimulation amplifies excitatory connections over inhibitory ones, thereby elevating the two-point discrimination threshold.","Thu, 7 Mar 2024 11:47:00 UTC (936 KB)"
"35","SGNet: Folding Symmetrical Protein Complex with Deep Learning","Zhaoqun Li, Jingcheng Yu, Qiwei Ye","Biomolecules (q-bio.BM)","Deep learning has made significant progress in protein structure prediction, advancing the development of computational biology. However, despite the high accuracy achieved in predicting single-chain structures, a significant number of large homo-oligomeric assemblies exhibit internal symmetry, posing a major challenge in structure determination. The performances of existing deep learning methods are limited since the symmetrical protein assembly usually has a long sequence, making structural computation infeasible. In addition, multiple identical subunits in symmetrical protein complex cause the issue of supervision ambiguity in label assignment, requiring a consistent structure modeling for the training. To tackle these problems, we propose a protein folding framework called SGNet to model protein-protein interactions in symmetrical assemblies. SGNet conducts feature extraction on a single subunit and generates the whole assembly using our proposed symmetry module, which largely mitigates computational problems caused by sequence length. Thanks to the elaborate design of modeling symmetry consistently, we can model all global symmetry types in quaternary protein structure prediction. Extensive experimental results on a benchmark of symmetrical protein complexes further demonstrate the effectiveness of our method.","Thu, 7 Mar 2024 10:39:48 UTC (6,369 KB)"
"36","Radial dependence of ionization clustering around a gold nanoparticle","Leo Thomas, Miriam Schwarze, Hans Rabus","Medical Physics (physics.med-ph)","This work explores the enhancement of ionization clusters around a gold nanoparticle (NP), indicative of the induction of DNA lesions, a potential trigger for cell-death. Monte Carlo track structure simulations were performed to determine (a) the fluence of incident photons and electrons in water around a gold NP under charged particle equilibrium conditions and (b) the density of ionization clusters produced on average as well as conditional on the occurrence of at least one interaction in the nanoparticle using Associated Volume Clustering. Absorbed dose was determined for comparison with a recent benchmark intercomparison. Reported quantities are normalized to primary fluence, allowing to establish a connection to macroscopic dosimetric quantities. The modification of the electron fluence spectrum by the gold NP is minor and mainly occurs at low energies. The net fluence of electrons emitted from the NP is dominated by electrons resulting from photon interactions. Smaller NPs cause noticeable peaks in the conditional frequency of clusters at distances around 50 nm to 100 nm from the NP surface. The number of clusters per energy imparted is increased at distances of up to 150 nm, and accordingly the enhancement in clustering notably surpasses that of dose enhancement. This work highlights the necessity of nanodosimetric analysis and suggests increased ionization clustering near the nanoparticles due to the emission of low energy Auger electrons. Whereas the electron component of the radiation field plays an important role in determining the background contribution to ionization clustering and energy imparted, the dosimetric effects of nanoparticles are governed by the interplay of secondary electron production by photon interaction (including low energy Auger electrons) and their ability to leave the nanoparticle.","Thu, 7 Mar 2024 10:04:44 UTC (10,217 KB)"
"37","BrainKnow -- Extracting, Linking, and Associating Neuroscience Knowledge","Cunqing Huangfu, Yi Zeng, Yuwei Wang, Dongsheng Wang, Zizhe Ruan","Digital Libraries (cs.DL)","The vast accumulation of neuroscience knowledge presents a challenge for researchers to timely and accurately locate the specific information they require. Constructing a knowledge engine that automatically extracts and organizes information from academic papers can provide researchers with timely and accurate informational services. We present the Brain Knowledge Engine (BrainKnow), which extracts and integrates neuroscience knowledge from published papers from PubMed. BrainKnow comprises a substantial repository, containing 3,626,931 relations spanning a broad spectrum of 37,011 neuroscience concepts extracted from 1817744 articles. The relations in BrainKnow can be accessed and navigated through a user-friendly web interface. Additionally, BrainKnow employs graph network algorithms for the recommendation and visualization of knowledge. BrainKnow is capable of automatic real-time updates. BrainKnow represents the first neuroscience knowledge graph that not only integrates knowledge in-depth but also facilitates fully automated updates.","Thu, 7 Mar 2024 09:20:38 UTC (1,923 KB)[v2] Mon, 11 Mar 2024 13:37:04 UTC (1,871 KB)"
"38","Preference optimization of protein language models as a multi-objective binder design paradigm","Pouria Mistani, Venkatesh Mysore","Biological Physics (physics.bio-ph)","We present a multi-objective binder design paradigm based on instruction fine-tuning and direct preference optimization (DPO) of autoregressive protein language models (pLMs). Multiple design objectives are encoded in the language model through direct optimization on expert curated preference sequence datasets comprising preferred and dispreferred distributions. We show the proposed alignment strategy enables ProtGPT2 to effectively design binders conditioned on specified receptors and a drug developability criterion. Generated binder samples demonstrate median isoelectric point (pI) improvements by $17\%-60\%$.","Thu, 7 Mar 2024 03:36:03 UTC (1,984 KB)"
"39","Hitchhiker's guide to cancer-associated lymphoid aggregates in histology images: manual and deep learning-based quantification approaches","Karina Silina, Francesco Ciompi","Tissues and Organs (q-bio.TO)","Quantification of lymphoid aggregates including tertiary lymphoid structures with germinal centers in histology images of cancer is a promising approach for developing prognostic and predictive tissue biomarkers. In this article, we provide recommendations for identifying lymphoid aggregates in tissue sections from routine pathology workflows such as hematoxylin and eosin staining. To overcome the intrinsic variability associated with manual image analysis (such as subjective decision making, attention span), we recently developed a deep learning-based algorithm called HookNet-TLS to detect lymphoid aggregates and germinal centers in various tissues. Here, we additionally provide a guideline for using manually annotated images for training and implementing HookNet-TLS for automated and objective quantification of lymphoid aggregates in various cancer types.","Wed, 6 Mar 2024 15:32:05 UTC (1,080 KB)"
"40","Understanding Biology in the Age of Artificial Intelligence","Elsa Lawrence, Adham El-Shazly, Srijit Seal, Chaitanya K Joshi, Pietro Liò, Shantanu Singh, Andreas Bender, Pietro Sormanni, Matthew Greenig","Artificial Intelligence (cs.AI)","Modern life sciences research is increasingly relying on artificial intelligence approaches to model biological systems, primarily centered around the use of machine learning (ML) models. Although ML is undeniably useful for identifying patterns in large, complex data sets, its widespread application in biological sciences represents a significant deviation from traditional methods of scientific inquiry. As such, the interplay between these models and scientific understanding in biology is a topic with important implications for the future of scientific research, yet it is a subject that has received little attention. Here, we draw from an epistemological toolkit to contextualize recent applications of ML in biological sciences under modern philosophical theories of understanding, identifying general principles that can guide the design and application of ML systems to model biological phenomena and advance scientific knowledge. We propose that conceptions of scientific understanding as information compression, qualitative intelligibility, and dependency relation modelling provide a useful framework for interpreting ML-mediated understanding of biological systems. Through a detailed analysis of two key application areas of ML in modern biological research - protein structure prediction and single cell RNA-sequencing - we explore how these features have thus far enabled ML systems to advance scientific understanding of their target phenomena, how they may guide the development of future ML models, and the key obstacles that remain in preventing ML from achieving its potential as a tool for biological discovery. Consideration of the epistemological features of ML applications in biology will improve the prospects of these methods to solve important problems and advance scientific understanding of living systems.","Wed, 6 Mar 2024 23:20:34 UTC (1,634 KB)"
"41","A Swarm Coherence Mechanism for Jellyfish","Erik Gengel, Zafrir Kuplik, Dror Angel, Eyal Heifetz","Adaptation and Self-Organizing Systems (nlin.AO)","We present a theory of jellyfish swarm formation and exemplify it with simulations of active Brownian particles. The motivation for our analysis is the phenomenon of jellyfish blooms in the ocean and clustering of jellyfish in tank experiments. We argue that such clusters emerge due to an externally induced phase transition of jellyfish density, such as convergent flows, which is then maintained and amplified by self-induced stimuli. Our study introduces three mechanisms relevant for a better understanding of jellyfish blooming that have not been taken into account before which are a signaling tracer, jellyfish-wall interaction and ignorance of external stimuli. Our results agree with the biological fact that jellyfish exhibit an extreme sensitivity to stimuli in order to achieve favorable aggregations. Based on our theoretical framework, we are able to provide a clear terminology for future experimental analysis of jellyfish swarming and we pinpoint potential limitations of tank experiments.","Wed, 6 Mar 2024 20:44:09 UTC (5,690 KB)"
"42","High throughput spectroscopy of pL droplets","Marc Sulliger, Jaime Ortega Arroyo, Romain Quidant","Quantitative Methods (q-bio.QM)","Droplet microfluidics offers a versatile platform for analyzing liquid samples. Despite its potential, there is a lack of techniques that allow to reliably probe individual circulating droplets. The prospect of combining droplet microfluidics with sensitive, broadband spectroscopic techniques would therefore unlock new capabilities for various disciplines, including biomedicine and biochemistry. Here we present an integrated optofluidic platform that seamlessly combines droplet microfluidics and advanced hyperspectral imaging. This enables high-resolution, label-free analysis of single picolitre-sized droplets, providing valuable insights into their content. As a proof-of-principle, we demonstrate the ability of our platform to study rapid dynamic changes in a heterogeneous population of plasmonic nanoparticles with millisecond-time resolution. Furthermore, we demonstrate the effectiveness of the platform in biosensing applied to short DNA strands, achieving a detection sensitivity in the range of 100 pM. Finally, we show that the platform provides the flexibility to monitor samples over extended periods of time (hours) in a multiplexed manner.","Wed, 6 Mar 2024 20:18:14 UTC (1,302 KB)"
"43","Inverse resolution of spatially varying diffusion coefficient using Physics-Informed neural networks","Sukirt Thakur, Ehsan Esmaili, Sarah Libring, Luis Solorio, Arezoo M. Ardekani","Quantitative Methods (q-bio.QM)","Resolving the diffusion coefficient is a key element in many biological and engineering systems, including pharmacological drug transport and fluid mechanics analyses. Additionally, these systems often have spatial variation in the diffusion coefficient which must be determined, such as for injectable drug-eluting implants into heterogeneous tissues. Unfortunately, obtaining the diffusion coefficient from images in such cases is an inverse problem with only discrete data points. The development of a robust method that can work with such noisy and ill-posed datasets to accurately determine spatially-varying diffusion coefficients is of great value across a large range of disciplines. Here, we developed an inverse solver that uses physics informed neural networks (PINNs) to calculate spatially-varying diffusion coefficients from numerical and experimental image data in varying biological and engineering applications. The residual of the transient diffusion equation for a concentration field is minimized to find the diffusion coefficient. The robustness of the method as an inverse solver was tested using both numerical and experimental datasets. The predictions show good agreement with both the numerical and experimental benchmarks; an error of less than 6.31% was obtained against all numerical benchmarks, while the diffusion coefficient calculated in experimental datasets matches the appropriate ranges of other reported literature values. Our work demonstrates the potential of using PINNs to resolve spatially-varying diffusion coefficients, which may aid a wide-range of applications, such as enabling better-designed drug-eluting implants for regenerative medicine or oncology fields.","Wed, 6 Mar 2024 18:15:47 UTC (1,494 KB)"
"44","Estimating the household secondary attack rate with the Incomplete Chain Binomial model","Jonas Christoffer Lindstrøm, Terese Bekkevold, Cathinka Halle Julin, Anna Hayman Robertson, Lisbeth Meyer Næss","Methodology (stat.ME)","The Secondary Attack Rate (SAR) is a measure of how infectious a communicable disease is, and is often estimated based on studies of disease transmission in households. The Chain Binomial model is a simple model for disease outbreaks, and the final size distribution derived from it can be used to estimate the SAR using simple summary statistics. The final size distribution of the Chain Binomial model assume that the outbreaks have concluded, which in some instances may require long follow-up time. We develop a way to compute the probability distribution of the number of infected before the outbreak has concluded, which we call the Incomplete Chain Binomial distribution. We study a few theoretical properties of the model. We develop Maximum Likelihood estimation routines for inference on the SAR and explore the model by analyzing two real world data sets.","Wed, 6 Mar 2024 18:54:27 UTC (1,071 KB)"
"45","Consciousness qua Mortal Computation","Johannes Kleiner","Neurons and Cognition (q-bio.NC)","Computational functionalism posits that consciousness is a computation. Here we show, perhaps surprisingly, that it cannot be a Turing computation. Rather, computational functionalism implies that consciousness is a novel type of computation that has recently been proposed by Geoffrey Hinton, called mortal computation.","Wed, 6 Mar 2024 18:37:06 UTC (11 KB)"
"46","CIBRA identifies genomic alterations with a system-wide impact on tumor biology","Soufyan Lakbir (1,2,3), Caterina Buranelli (1,2), Gerrit A. Meijer (2), Jaap Heringa (1), Remond J. A. Fijneman (2), Sanne Abeln (1,3) ((1) Bioinformatics group Vrije Universiteit Amsterdam, (2) Translational Gastrointestinal Oncology group Netherlands Cancer Institute, (3) AI Technology for Life group Utrecht University)","Genomics (q-bio.GN)","Background: Genomic instability is a hallmark of cancer, leading to many somatic alterations. Identifying which alterations have a system-wide impact is a challenging task. Nevertheless, this is an essential first step for prioritizing potential biomarkers. We developed CIBRA (Computational Identification of Biologically Relevant Alterations), a method that determines the system-wide impact of genomic alterations on tumor biology by integrating two distinct omics data types: one indicating genomic alterations (e.g., genomics), and another defining a system-wide expression response (e.g., transcriptomics). CIBRA was evaluated with genome-wide screens in 33 cancer types using primary and metastatic cancer data from the Cancer Genome Atlas and Hartwig Medical Foundation. Results: We demonstrate the capability of CIBRA by successfully confirming the impact of point mutations in experimentally validated oncogenes and tumor suppressor genes. Surprisingly, many genes affected by structural variants were identified to have a strong system-wide impact (30.3%), suggesting that their role in cancer development has thus far been largely underreported. Additionally, CIBRA can identify impact with only ten cases and controls, providing a novel way to prioritize genomic alterations with a prominent role in cancer biology. Conclusions: Our findings demonstrate that CIBRA can identify cancer drivers by combining genomics and transcriptomics data. Moreover, our work shows an unexpected substantial system-wide impact of structural variants in cancer. Hence, CIBRA has the potential to preselect and refine current definitions of genomic alterations to derive more nuanced biomarkers for diagnostics, disease progression, and treatment response. CIBRA is available at this https URL","Wed, 6 Mar 2024 16:19:11 UTC (9,729 KB)"
"47","DeepCRE: Revolutionizing Drug R&D with Cutting-Edge Computational Models","Yushuai Wu","Artificial Intelligence (cs.AI)","The fields of pharmaceutical development and therapeutic application both face substantial challenges. The therapeutic domain calls for more treatment alternatives, while numerous promising pre-clinical drugs have failed in clinical trials. One of the reasons is the inadequacy of Cross-drug Response Evaluation (CRE) during the late stage of drug development. Although in-silico CRE models offer a solution to this problem, existing methodologies are either limited to early development stages or lack the capacity for a comprehensive CRE analysis. Herein, we introduce a novel computational model named DeepCRE and present the potential of DeepCRE in advancing therapeutic discovery and development. DeepCRE outperforms the existing best models by achieving an average performance improvement of 17.7\% in patient-level CRE and a 5-fold increase in indication-level CRE. Furthermore, DeepCRE has identified six drug candidates that show significantly greater effectiveness than a comparator set of two approved drugs in 5/8 colorectal cancer (CRC) organoids. This highlights DeepCRE's ability to identify a collection of drug candidates with superior therapeutic effects, underscoring its potential to revolutionize the field of therapeutic development.","Wed, 6 Mar 2024 15:03:09 UTC (19,588 KB)[v2] Sat, 9 Mar 2024 15:01:52 UTC (19,589 KB)"
"48","Diffusion on language model embeddings for protein sequence generation","Viacheslav Meshchaninov, Pavel Strashnov, Andrey Shevtsov, Fedor Nikolaev, Nikita Ivanisenko, Olga Kardymon, Dmitry Vetrov","Machine Learning (cs.LG)","Protein design requires a deep understanding of the inherent complexities of the protein universe. While many efforts lean towards conditional generation or focus on specific families of proteins, the foundational task of unconditional generation remains underexplored and undervalued. Here, we explore this pivotal domain, introducing DiMA, a model that leverages continuous diffusion on embeddings derived from the protein language model, ESM-2, to generate amino acid sequences. DiMA surpasses leading solutions, including autoregressive transformer-based and discrete diffusion models, and we quantitatively illustrate the impact of the design choices that lead to its superior performance. We extensively evaluate the quality, diversity, distribution similarity, and biological relevance of the generated sequences using multiple metrics across various modalities. Our approach consistently produces novel, diverse protein sequences that accurately reflect the inherent structural and functional diversity of the protein space. This work advances the field of protein design and sets the stage for conditional models by providing a robust framework for scalable and high-quality protein sequence generation.","Wed, 6 Mar 2024 14:15:20 UTC (11,332 KB)"
"49","The use of next-generation sequencing in personalized medicine","Liya Popova, Valerie J. Carabetta","Genomics (q-bio.GN)","The revolutionary progress in development of next-generation sequencing (NGS) technologies has made it possible to deliver accurate genomic information in a timely manner. Over the past several years, NGS has transformed biomedical and clinical research and found its application in the field of personalized medicine. Here we discuss the rise of personalized medicine and the history of NGS. We discuss current applications and uses of NGS in medicine, including infectious diseases, oncology, genomic medicine, and dermatology. We provide a brief discussion of selected studies where NGS was used to respond to wide variety of questions in biomedical research and clinical medicine. Finally, we discuss the challenges of implementing NGS into routine clinical use.","Wed, 6 Mar 2024 13:14:25 UTC (727 KB)"
"50","FingerNet: EEG Decoding of A Fine Motor Imagery with Finger-tapping Task Based on A Deep Neural Network","Young-Min Go, Seong-Hyun Yu, Hyeong-Yeong Park, Minji Lee, Ji-Hoon Jeong","Signal Processing (eess.SP)","Brain-computer interface (BCI) technology facilitates communication between the human brain and computers, primarily utilizing electroencephalography (EEG) signals to discern human intentions. Although EEG-based BCI systems have been developed for paralysis individuals, ongoing studies explore systems for speech imagery and motor imagery (MI). This study introduces FingerNet, a specialized network for fine MI classification, departing from conventional gross MI studies. The proposed FingerNet could extract spatial and temporal features from EEG signals, improving classification accuracy within the same hand. The experimental results demonstrated that performance showed significantly higher accuracy in classifying five finger-tapping tasks, encompassing thumb, index, middle, ring, and little finger movements. FingerNet demonstrated dominant performance compared to the conventional baseline models, EEGNet and DeepConvNet. The average accuracy for FingerNet was 0.3049, whereas EEGNet and DeepConvNet exhibited lower accuracies of 0.2196 and 0.2533, respectively. Statistical validation also demonstrates the predominance of FingerNet over baseline networks. For biased predictions, particularly for thumb and index classes, we led to the implementation of weighted cross-entropy and also adapted the weighted cross-entropy, a method conventionally employed to mitigate class imbalance. The proposed FingerNet involves optimizing network structure, improving performance, and exploring applications beyond fine MI. Moreover, the weighted Cross Entropy approach employed to address such biased predictions appears to have broader applicability and relevance across various domains involving multi-class classification tasks. We believe that effective execution of motor imagery can be achieved not only for fine MI, but also for local muscle MI","Wed, 6 Mar 2024 08:05:53 UTC (3,961 KB)"
