"","title","author","subject","abstract","meta"
"67","CRISPR: Ensemble Model","Mohammad Rostami, Amin Ghariyazi, Hamed Dashti, Mohammad Hossein Rohban, Hamid R. Rabiee","Machine Learning (cs.LG)","Clustered Regularly Interspaced Short Palindromic Repeats (CRISPR) is a gene editing technology that has revolutionized the fields of biology and medicine. However, one of the challenges of using CRISPR is predicting the on-target efficacy and off-target sensitivity of single-guide RNAs (sgRNAs). This is because most existing methods are trained on separate datasets with different genes and cells, which limits their generalizability. In this paper, we propose a novel ensemble learning method for sgRNA design that is accurate and generalizable. Our method combines the predictions of multiple machine learning models to produce a single, more robust prediction. This approach allows us to learn from a wider range of data, which improves the generalizability of our model. We evaluated our method on a benchmark dataset of sgRNA designs and found that it outperformed existing methods in terms of both accuracy and generalizability. Our results suggest that our method can be used to design sgRNAs with high sensitivity and specificity, even for new genes or cells. This could have important implications for the clinical use of CRISPR, as it would allow researchers to design more effective and safer treatments for a variety of diseases.","Tue, 5 Mar 2024 14:55:14 UTC (720 KB)"
"68","Implicit-Explicit simulation of Mass-Spring-Charge Systems","Zhiyuan Zhang, Zhaocheng Liu, Stefanos Papanicolopulos, Kartic Subr","Graphics (cs.GR)","Point masses connected by springs, or mass-spring systems, are widely used in computer animation to approximate the behavior of deformable objects. One of the restrictions imposed by these models is that points that are not topologically constrained (linked by a spring) are unable to interact with each other explicitly. Such interactions would introduce a new dimension for artistic control and animation within the computer graphics community. Beyond graphics, such a model could be an effective proxy to use for model-based learning of complex physical systems such as molecular biology. We propose to imbue masses in a mass-spring system with electrostatic charge leading a system with internal forces between all pairs of charged points -- regardless of whether they are linked by a spring. We provide a practical and stable algorithm to simulate charged mass-spring systems over long time horizons. We demonstrate how these systems may be controlled via parameters such as guidance electric fields or external charges, thus presenting fresh opportunities for artistic authoring. Our method is especially appropriate for computer graphics applications due to its robustness at larger simulation time steps.","Tue, 5 Mar 2024 14:34:13 UTC (48,434 KB)"
"69","Possible and Impossible Inferences From Reconstructed Evolutionary Processes using Phylogenies as an Example","Niklas Hohmann","Quantitative Methods (q-bio.QM)","Our understanding of past evolutionary change is often based on reconstructions based on incomplete data, raising fundamental questions about the degree to which we can make reliable inferences about past evolutionary processes. This was demonstrated by Louca and Pennell (2020), who showed that each pure-birth process can be generated by an infinite number of birth-death processes. Here, I explore what it means to reconstruct past evolutionary change with three approaches from measure theory, group theory, and homotopy theory to better understand structural constraint and origins of (non)identifiability. As an example, the developed framework is applied to the case of birth-death processes.","Mon, 4 Mar 2024 16:48:14 UTC (12 KB)"
"70","Assessing the distribution of cancer stem cells in tumorspheres","Jerónimo Fotinós, María Paula Marks, Lucas Barberis, Luciano Vellón","Quantitative Methods (q-bio.QM)","In previous theoretical research, we inferred that cancer stem cells (CSCs), the cells that presumably drive tumor growth and resistance to conventional cancer treatments, are not uniformly distributed in the bulk of a tumorsphere. To confirm this theoretical prediction, we cultivated tumorspheres enriched in CSCs, and performed immunofluorecent detection of the stemness marker SOX2 using a confocal microscope. In this article, we present a method developed to process the images that reconstruct the amount and location of the CSCs in the tumorspheres. Its advantage is the use of a statistical criterion to classify the cells in stem and differentiated instead of setting an arbitrary threshold. From the analysis of the results of the methods using graph theory and computational modeling, we concluded that the distribution of Cancer Stem Cells in an experimental tumorsphere is non-homogeneous. This method is independent of the tumorsphere assay being useful for analyzing images in which several different kinds of cells are stained with different markers.","Tue, 5 Mar 2024 14:03:56 UTC (9,787 KB)"
"71","G4-Attention: Deep Learning Model with Attention for predicting DNA G-Quadruplexes","Shrimon Mukherjee, Pulakesh Pramanik, Partha Basuchowdhuri, Santanu Bhattacharya","Machine Learning (cs.LG)","G-Quadruplexes are the four-stranded non-canonical nucleic acid secondary structures, formed by the stacking arrangement of the guanine tetramers. They are involved in a wide range of biological roles because of their exceptionally unique and distinct structural characteristics. After the completion of the human genome sequencing project, a lot of bioinformatic algorithms were introduced to predict the active G4s regions \textit{in vitro} based on the canonical G4 sequence elements, G-\textit{richness}, and G-\textit{skewness}, as well as the non-canonical sequence features. Recently, sequencing techniques like G4-seq and G4-ChIP-seq were developed to map the G4s \textit{in vitro}, and \textit{in vivo} respectively at a few hundred base resolution. Subsequently, several machine learning approaches were developed for predicting the G4 regions using the existing databases. However, their prediction models were simplistic, and the prediction accuracy was notably poor. In response, here, we propose a novel convolutional neural network with Bi-LSTM and attention layers, named G4-attention, to predict the G4 forming sequences with improved accuracy. G4-attention achieves high accuracy and attains state-of-the-art results in the G4 prediction task. Our model also predicts the G4 regions accurately in the highly class-imbalanced datasets. In addition, the developed model trained on the human genome dataset can be applied to any non-human genome DNA sequences to predict the G4 formation propensities.","Tue, 5 Mar 2024 08:34:04 UTC (2,466 KB)"
"72","Early quantum computing applications on the path towards precision medicine","Frederik F. Flöther","Quantitative Methods (q-bio.QM)","The last few years have seen rapid progress in transitioning quantum computing from lab to industry. In healthcare and life sciences, more than 40 proof-of-concept experiments and studies have been conducted; an increasing number of these are even run on real quantum hardware. Major investments have been made with hundreds of millions of dollars already allocated towards quantum applications and hardware in medicine. In addition to pharmaceutical and life sciences uses, clinical and medical applications are now increasingly coming into the picture. This chapter focuses on three key use case areas associated with (precision) medicine, including genomics and clinical research, diagnostics, and treatments and interventions. Examples of organizations and the use cases they have been researching are given; ideas how the development of practical quantum computing applications can be further accelerated are described.","Tue, 5 Mar 2024 07:41:29 UTC (2,905 KB)"
"73","A genome-scale deep learning model to predict gene expression changes of genetic perturbations from multiplex biological networks","Lingmin Zhan, Yuanyuan Zhang, Yingdong Wang, Aoyi Wang, Caiping Cheng, Jinzhong Zhao, Wuxia Zhang, Peng Lia, Jianxin Chen","Genomics (q-bio.GN)","Systematic characterization of biological effects to genetic perturbation is essential to the application of molecular biology and biomedicine. However, the experimental exhaustion of genetic perturbations on the genome-wide scale is challenging. Here, we show that TranscriptionNet, a deep learning model that integrates multiple biological networks to systematically predict transcriptional profiles to three types of genetic perturbations based on transcriptional profiles induced by genetic perturbations in the L1000 project: RNA interference (RNAi), clustered regularly interspaced short palindromic repeat (CRISPR) and overexpression (OE). TranscriptionNet performs better than existing approaches in predicting inducible gene expression changes for all three types of genetic perturbations. TranscriptionNet can predict transcriptional profiles for all genes in existing biological networks and increases perturbational gene expression changes for each type of genetic perturbation from a few thousand to 26,945 genes. TranscriptionNet demonstrates strong generalization ability when comparing predicted and true gene expression changes on different external tasks. Overall, TranscriptionNet can systemically predict transcriptional consequences induced by perturbing genes on a genome-wide scale and thus holds promise to systemically detect gene function and enhance drug development and target discovery.","Tue, 5 Mar 2024 07:31:46 UTC (2,643 KB)"
"74","DeepBioisostere: Discovering Bioisosteres with Deep Learning for a Fine Control of Multiple Molecular Properties","Hyeongwoo Kim, Seokhyun Moon, Wonho Zhung, Jaechang Lim, Woo Youn Kim","Biomolecules (q-bio.BM)","Optimizing molecules to improve their properties is a fundamental challenge in drug design. For a fine-tuning of molecular properties without losing bio-activity validated in advance, the concept of bioisosterism has emerged. Many in silico methods have been proposed for discovering bioisosteres, but they require expert knowledge for their applications or are restricted to known databases. Here, we introduce DeepBioisostere, a deep generative model to design suitable bioisosteric replacements. Our model allows an end-to-end chemical replacement by intelligently selecting fragments for removal and insertion along with their attachment orientation. Through various scenarios of multiple property control, we showcase the model's capability to modulate specific properties, addressing the challenge in molecular optimization. Our model's innovation lies in its capacity to design a bioisosteric replacement reflecting the compatibility with the surroundings of the modification site, facilitating the control of sophisticated properties like drug-likeness. DeepBioisostere can also provide previously unseen bioisosteric replacements, highlighting its capability for exploring diverse chemical modifications rather than just mining them from known databases. Lastly, we employed DeepBioisostere to improve the sensitivity of a known SARS-CoV-2 main protease inhibitor to the E166V mutant that exhibits drug resistance to the inhibitor, demonstrating its potential application in lead optimization.","Tue, 5 Mar 2024 06:55:43 UTC (12,779 KB)"
"75","Drug resistance revealed by in silico deep mutational scanning and mutation tracker","Dong Chen, Gengzhuo Liu, Hongyan Du, Junjie Wee, Rui Wang, Jiahui Chen, Jana Shen, Guo-Wei Wei","Quantitative Methods (q-bio.QM)","As COVID-19 enters its fifth year, it continues to pose a significant global health threat, with the constantly mutating SARS-CoV-2 virus challenging drug effectiveness. A comprehensive understanding of virus-drug interactions is essential for predicting and improving drug effectiveness, especially in combating drug resistance during the pandemic. In response, the Path Laplacian Transformer-based Prospective Analysis Framework (PLFormer-PAF) has been proposed, integrating historical data analysis and predictive modeling strategies. This dual-strategy approach utilizes path topology to transform protein-ligand complexes into topological sequences, enabling the use of advanced large language models for analyzing protein-ligand interactions and enhancing its reliability with factual insights garnered from historical data. It has shown unparalleled performance in predicting binding affinity tasks across various benchmarks, including specific evaluations related to SARS-CoV-2, and assesses the impact of virus mutations on drug efficacy, offering crucial insights into potential drug resistance. The predictions align with observed mutation patterns in SARS-CoV-2, indicating that the widespread use of the Pfizer drug has lead to viral evolution and reduced drug efficacy. PLFormer-PAF's capabilities extend beyond identifying drug-resistant strains, positioning it as a key tool in drug discovery research and the development of new therapeutic strategies against fast-mutating viruses like COVID-19.","Tue, 5 Mar 2024 02:35:47 UTC (40,404 KB)"
"76","Renal function changes in chronic hepatitis B patients","Jinhua Zhao, Lili Wu, Xiaoan Yang, Zhilaing Gao, Hong Deng","Quantitative Methods (q-bio.QM)","The best way to treat chronic hepatitis B is with pegylated interferon alone or with oral antiviral drugs. There is limited research comparing the renal safety of entecavir and tenofovir when used with pegylated interferon. This study will compare changes in renal function in chronic hepatitis B patients treated with pegylated interferon and either entecavir or tenofovir. The study included a cohort of 836 patients with chronic hepatitis B (CHB) who received treatment with pegylated interferon (IFN) either alone or in combination with entecavir (ETV) and tenofovir (TDF) between the years 2018 and 2021. Of these patients, 713 were included in a matched analysis comparing outcomes between those who were cured and those who were uncured, while 123 patients received IFN alone as a control group for comparison with the ETV and TDF treatment groups. The primary outcome measured was the change in renal function, specifically estimated glomerular filtration rate (eGFR), cystatin C (CysC), and inorganic phosphorus (IPHOS). Patients were categorized into stage 1 or stage 2 based on a baseline eGFR of less than 90 ml/min/m^2 Results: 125 CHB patients were matched 1:1 in both the combined treatment and cured groups. Baseline eGFR, CysC, and IPHOS levels were similar between the groups. Renal function in stage 1 and stage 2 groups showed a decreasing trend at 48 weeks after an initial increase.Correlation analysis showed significant relationships between changes in ALT and eGFR values at 12 weeks in both non-cured and cured groups. Conclusions: Over the 48-week duration of combined treatment in patients with chronic hepatitis B (CHB), it was found that both Tenofovir Disoproxil Fumarate (TDF) and Entecavir (ETV) did not lead to an increase in renal injury.","Mon, 4 Mar 2024 06:10:14 UTC (1,455 KB)"
"77","Fluid ejections in nature","Elio J. Challita, Pankaj Rohilla, M. Saad Bhamla","Quantitative Methods (q-bio.QM)","From microscopic fungi to colossal whales, fluidic ejections are a universal and intricate phenomenon in biology, serving vital functions such as animal excretion, venom spraying, prey hunting, spore dispersal, and plant guttation. This review delves into the complex fluid physics of ejections across various scales, exploring both muscle-powered active systems and passive mechanisms driven by gravity or osmosis. We introduce a framework using dimensionless numbers to delineate transitions from dripping to jetting and elucidate the governing forces. Highlighting the understudied area of complex fluid ejections, this work not only rationalizes the biophysics involved but also uncovers potential engineering applications in soft robotics, additive manufacturing, and drug delivery. By bridging biomechanics, the physics of living systems, and fluid dynamics, this review offers valuable insights into the diverse world of fluid ejections and paves the way for future bioinspired research across the spectrum of life.","Mon, 4 Mar 2024 02:12:21 UTC (23,280 KB)"
"78","Double trouble: Predicting new variant counts across two heterogeneous populations","Yunyi Shen, Lorenzo Masoero, Joshua G. Schraiber, Tamara Broderick","Methodology (stat.ME)","Collecting genomics data across multiple heterogeneous populations (e.g., across different cancer types) has the potential to improve our understanding of disease. Despite sequencing advances, though, resources often remain a constraint when gathering data. So it would be useful for experimental design if experimenters with access to a pilot study could predict the number of new variants they might expect to find in a follow-up study: both the number of new variants shared between the populations and the total across the populations. While many authors have developed prediction methods for the single-population case, we show that these predictions can fare poorly across multiple populations that are heterogeneous. We prove that, surprisingly, a natural extension of a state-of-the-art single-population predictor to multiple populations fails for fundamental reasons. We provide the first predictor for the number of new shared variants and new total variants that can handle heterogeneity in multiple populations. We show that our proposed method works well empirically using real cancer and population genetics data.","Mon, 4 Mar 2024 16:03:21 UTC (9,958 KB)"
"79","AlphaFold two years on: validation and impact","Oleg Kovalevskiy, Juan Mateos-Garcia, Kathryn Tunyasuvunakool","Biomolecules (q-bio.BM)","Two years on from the initial release of AlphaFold2 we have seen its widespread adoption as a structure prediction tool. Here we discuss some of the latest work based on AlphaFold2, with a particular focus on its use within the structural biology community. This encompasses use cases like speeding up structure determination itself, enabling new computational studies, and building new tools and workflows. We also look at the ongoing validation of AlphaFold2, as its predictions continue to be compared against large numbers of experimental structures to further delineate the model's capabilities and limitations.","Mon, 4 Mar 2024 15:31:12 UTC (258 KB)"
"80","Tractography derived quantitative estimates of tissue microstructure depend on streamline length: A characterization and method of adjustment","Richard G. Carson, Alexander Leemans","Quantitative Methods (q-bio.QM)","Tractography algorithms are used extensively to delineate white matter structures, by operating on the voxel-wise information generated through the application of diffusion tensor imaging (DTI) or other models to diffusion weighted (DW) magnetic resonance imaging (MRI) data. We demonstrate that these methods commonly yield systematic streamline length dependent distortions of tractography derived tissue microstructure parameters, such as fractional anisotropy (FA). This dependency may be described as piecewise linear. For streamlines shorter than an inflection point (determined for a group of tracts delineated for each individual brain), estimates of tissue microstructure exhibit a positive linear relation with streamline length. For streamlines longer than the point of inflection, the association is weaker, with the slope of the relationship between streamline length and tissue microstructure differing only marginally from zero. As the dependency is most pronounced for a range of streamline lengths encountered typically in DW imaging of the human brain (less than ~100 mm), our results suggest that some previous estimates of tissue microstructure should be treated with considerable caution. A method is described, whereby an Akaike information weighted average of linear, Blackman and piecewise linear model predictions, may be used to compensate effectively for the dependence of FA (and other estimates of tissue microstructure) on streamline length, across the entire range of streamline lengths present in each specimen.","Mon, 4 Mar 2024 14:58:31 UTC (2,409 KB)"
"81","Piezoelectricity and flexoelectricity in biological cells: The role of cell structure and organelles","Akepogu Venkateshwarlu, Akshayveer, Sundeep Singh, Roderick Melnik","Quantitative Methods (q-bio.QM)","Living tissues experience various external forces on cells, influencing their behaviour, physiology, shape, gene expression, and destiny through interactions with their environment. Despite much research done in this area, challenges remain in our better understanding of the behaviour of the cell in response to external stimuli, including the arrangement, quantity, and shape of organelles within the cell. This study explores the electromechanical behaviour of biological cells, including organelles like microtubules, mitochondria, nuclei, and cell membranes. Two distinct cell structures have been developed to explore the cell responses to mechanical displacement, resembling actual cell shapes. The finite element method has been utilized to integrate the linear piezoelectric and non-local flexoelectric effects accurately. It is found that the longitudinal stress is absent and only the transverse stress plays a crucial role when the mechanical load is imposed on the top side of the cell through compressive displacement. The impact of flexoelectricity is elucidated by introducing a new parameter called the maximum electric potential ratio ($V_{\text{R,max}}$). It has been found that $V_{\text{R,max}}$ depends upon the orientation angle and shape of the microtubules. Further, the study reveals that the number of microtubules significantly impacts effective elastic and piezoelectric coefficients, affecting cell behaviour based on structure, microtubule orientation, and mechanical stress direction. The insight obtained from the current study can assist in advancements in medical therapies such as tissue engineering and regenerative medicine.","Mon, 4 Mar 2024 13:52:14 UTC (10,287 KB)"
"82","Advancing Gene Selection in Oncology: A Fusion of Deep Learning and Sparsity for Precision Gene Selection","Akhila Krishna, Ravi Kant Gupta, Pranav Jeevan, Amit Sethi","Genomics (q-bio.GN)","Gene selection plays a pivotal role in oncology research for improving outcome prediction accuracy and facilitating cost-effective genomic profiling for cancer patients. This paper introduces two gene selection strategies for deep learning-based survival prediction models. The first strategy uses a sparsity-inducing method while the second one uses importance based gene selection for identifying relevant genes. Our overall approach leverages the power of deep learning to model complex biological data structures, while sparsity-inducing methods ensure the selection process focuses on the most informative genes, minimizing noise and redundancy. Through comprehensive experimentation on diverse genomic and survival datasets, we demonstrate that our strategy not only identifies gene signatures with high predictive power for survival outcomes but can also streamlines the process for low-cost genomic profiling. The implications of this research are profound as it offers a scalable and effective tool for advancing personalized medicine and targeted cancer therapies. By pushing the boundaries of gene selection methodologies, our work contributes significantly to the ongoing efforts in cancer genomics, promising improved diagnostic and prognostic capabilities in clinical settings.","Mon, 4 Mar 2024 10:44:57 UTC (917 KB)"
"83","NIR ICG-Enhanced Fluorescence: A Quantitative Evaluation of Bowel Microperfusion and Its Relation to Central Perfusion in Colorectal Surgery","N. Depalma, S. D Ugo, F. Manoochehri, A. Libia, W. Sergi, T. R. L. Marchese, S. Forciniti, L. L. del Mercato, P. Piscitelli, S. Garritano, F. Castellana, R. Zupo, M. G. Spampinato","Tissues and Organs (q-bio.TO)","Background: To date, no standardized protocols nor a quantitative assessment of the near-infrared fluorescence angiography with indocyanine green (NIR-ICG) are available. The aim of this study was to evaluate the timing of fluorescence as a reproducible parameter and its efficacy in predicting anastomotic leakage (AL) in colorectal surgery. Methods: A consecutive cohort of 108 patients undergoing minimally invasive elective procedures for colorectal cancer was prospectively enrolled. The difference between macro and microperfusion DeltaT was obtained by calculating the timing of fluorescence at the level of iliac artery division and colonic wall, respectively. Results: Subjects with a DeltaT higher 15.5 s had a higher tendency to develop an AL (p lower 0.01). The DeltaT/heart rate interaction was found to predict AL with an odds ratio of 1.02 (p lower 0.01); a cut-off threshold of 832 was identified (sensitivity 0.86, specificity 0.77). Perfusion parameters were also associated with a faster bowel motility resumption and a reduced length of hospital stay. Conclusions: The analysis of the timing of fluorescence provides a quantitative, easy evaluation of tissue perfusion. A DeltaT/HR interaction higher 832 may be used as a real-time parameter to guide surgical decision making in colorectal surgery.","Mon, 4 Mar 2024 08:51:01 UTC (795 KB)"
