"title","username","date","stars","content"
"Saltburn","reelreviewsandrecommendations","23 December 2023",610,"It is 2006, and scholarship student Oliver Quick has just arrived at Oxford. He doesn't fit in with the upper-class atmosphere and has no acquaintances. After befriending Felix Catton, a popular and wealthy fellow student, however, Oliver finally seems to find his place at the University. Invited to the Catton family home- Saltburn- for the summer holidays, Oliver is thrust into the dark heart of the blue bloods. Nothing is as it seems though, as the idyllic vacation transforms into one from hell itself.Written and directed by Emerald Fennell, 'Saltburn' is an initially intriguing, though ultimately irritatingly derivative, predictable psychological comic-horror. Fennell's narrative begins with promise. In the first act, you aren't sure who to trust, nor where the story is heading. However, after the action moves to the manor house, Saltburn, things devolve into a messy and obvious retread of ideas that have been expressed more eloquently in previous films, be they 'The Talented Mr. Ripley, 'Teorema' or 'The Servant.'Those films examined themes such as class difference, obsessiveness, personality and manipulation with aplomb and ingenuity. Fennell appears content to skirt around the edges of these themes, never going into them with depth. Nor are the characters in her narrative provided with any kind of motivation for their actions. One, in particular, acts in a violent vacuum of self-obsession and jealously- but why? What made this character the way they are? Fennel never bothers to tell us, seeming satisfied to leave audiences in the dark.Moreover, her characterization is largely based on stereotypes and cliches. Oliver is essentially just a less charismatic, Scouse Tom Ripley, with darkness beneath a thin veneer of awkward shyness. Felix is exactly like Ripley's object of obsession, Dickie Greenleaf, while his eccentric family are people we've seen before in countless films which mock the aristocracy- 'The Ruling Class' among them. Familiar and lacking in depth, Fennell's characters aren't particularly interesting, nor is her narrative particularly original. Further, while her dialogue is frequently funny, it can also be pretentious- particularly during Oliver's intermittent narration.Throughout the film, Fennell handles the material with great deference- too much, one might argue. She lets uncomfortable scenes linger interminably, seeming to think this imbues them with some kind of raw power. The ending, featuring full-frontal nudity- reminiscent of the music video to Liam Gallagher's 'Once,' starring a thankfully clothed Eric Cantona- seems self-indulgent and, shall we say, cocky. Furthermore, a twist in the last act is neither surprising nor effective, while also sending the film into the realm of fantasy; so completely does it abandon real-world logic.Conversely, Linus Sandgren's glossy cinematography is striking. Sandgren makes excellent use of colours and unconventional shots and angles, heightening the suspense of the narrative, as well as compounding the decadence of the Catton family. He employs a ratio of 1.33:1, giving the film a top-heavy, boxed-in look, making locations feel daunting. It is work full of contrast- although, a cynical critic might suggest an over-reliance on cliched visual metaphors, such as reflections, or the obvious juxtaposition of characters wearing devil horns and angel wings.However, Sandgren's visuals generally come as a boon to proceedings, as does Suzie Davies' rich production design. Textured and detailed, her work fosters a vivid, immersive atmosphere, which Sophie Canale's costume design and Charlotte Dirickx's set decoration compounds. In addition, Anthony Willis's score is stirring. His original pieces are seedy and evocative, while songs used throughout- perhaps most notably Sophie Ellis-Bextor's 'Murder On The Dancefloor'- complement the narrative.Barry Keoghan stars as Oliver, alongside Jacob Elordi as Felix, Alison Oliver as Felix's sister Venetia and Rosamund Pike as Felix's mother Elspeth. Keoghan is a fascinating actor, who plays strange characters with verve and intelligence. Here, however, he gives an inconsistent performance. When playing Oliver as a weird, insular personality, he shines; though when he has to display his dominant side Keoghan lacks conviction and doesn't convince- an oddly played, oddly written night-time scene with Venetia being clearest evidence of this.Elordi does much more assured work, despite the fact that the character is just a 2006 version of the aforementioned Greenleaf. He impresses though, overcoming the scant characterisation of the role. Oliver is excellent, underplaying the complexities of her character, while Pike steals the show as the eccentric Elspeth. Richard E. Grant also stars, as Felix's father, but is criminally under-utilised, while Archie Madekwe's grating performance as Felix's cousin is smug and one-note.In conclusion, Emerald Fennell's 'Saltburn' is a film trying to provoke, though isn't as challenging nor original as its creator thinks it is. Though it is funny from time to time, and the first act is intriguing and suspenseful; the film is ultimately an uneven, predictable and derivative affair. While the cinematography is striking and the score atmospheric, the performance of star Barry Keoghan is inconsistent. Although Rosamund Pike is a delight, the film around her is not worthy of her talents, nor can she save it completely. Not to rub salt in the wound, but this film doesn't burn as brightly as it could have."
"Saltburn","darthsteele-39338","30 December 2023",110,"Other reviewers use the word ""derivative"" a lot to describe this film. They're not wrong! And my God this is a tedious film to try to get through! The so-called twist at the end is anything but. There's absolutely no reward at the end for sticking with this grotesque and uninteresting film. The suspenseful bits aren't suspenseful. The funny bits aren't funny and the sexy bits aren't sexy. The only thing the film maker succeeded at was making the grotesque parts nauseatingly grotesque. There's not one interesting nor sympathetic character in the bunch. There's no reason to care about what happens to any of them! A complete waste of time!"
"Saltburn","DoNotComeToTheCinemaDepressed","19 November 2023",610,"Just Got out of a Packed Saltburn Screening.WARNING 🚫🛀 - This Film Has Multiple Nasty Moments . There were Multiple Gasps and Audible ""oh god"" moments from the Audience 👅😳Quick Side Note - I have no Problems with this Script and Twist, but looking back, it's just not executed very well due to the lack of development, actions and dialogue prior to the Closing of the Film.So, Positives First -1. 🦇 The Gothic Production Design was Outstanding, Coupled with the Cinematography, Some Great Camera Work and there were Several Gorgeous Shots. That Scene with Barry Keoghans' Character(Oliver) Walking Towards Venetia and it had almost a Blue Tint to it was Outstanding. That Particular Scene had this Strong Gothic Vibe to it.2. 🎾 The Performances were Good Across the Board, Barry Keoghan, Jacob Elordi, Alison Oliver, Archie Madekwe, Richard E Grant, all Good. Rosamund Pike was Exceptionally Good.3. 😆 Many of the Comedic Moments worked and had parts of the audience laughing and 1 particular Joke Got a Belly Laugh out of the Audience ""It was all too Wet"" - by Rosamund Pike 😂🤣4. I loved the Funeral Scene with the ""Butler Knows who did it, Stare from afar"" Scene. (The Writer did a little spin on the Butler did it😏)On to the NegativesNegatives -1. 🚩One of the Main Problems I have with this Film, is I didn't really buy Barry Keoghans' Character(Oliver) being Infatuated(in a normal way, not the Gross out Stuff) with Jacob Elordis' Character(Felix). It just didn't come across on screen that way.2. 🚩But you're probably saying, ""But, he never really loved him anyway, so who cares?"" Ok, so he hated him right? So why is he Drinking His Juice out of the Bathtub🛁😳 and Laying (and that's Putting it nicely) on top of his Grave? So is Oliver Mentally ill? But he seemed to have come from a somewhat stable household. 🙇🤷3. 🚩Another big Problem with the film is that, what is Olivers Motivation? Did he want the Money & Lifestyle? Did he want to Punish this Family? What Exactly did he want? The Plotline does need subtlety yes, but for this particular point, it needs to have a motivation. By the End, The Film doesn't really Convey this. It's all Confusion. 😕4. 🚩The Supposed Danger of Oliver Having an Affair with Rosamund Pikes' character(Elsbeth) was not there at all. A compliment here and there is not enough. On top of that, they could of done more with this angle.5. Moreover, the way in which Oliver Embedded himself into the Family, wasn't done that well.6. For me, when a Certain Character Dies and the Subsequent Scenes after His Death. The Film Just sort of fell apart (for me). It went from Build, Build, Build, ""Ok this is Ok, were building towards something"", then the Death Happens and then some scenes happen and then I thought to myself ""Sigh, the films Level just went down 1 or 2 Levels""😔7. 🤦🏻 Near The Very Ending with the Montage ""of Events"" was just not the way to Do That. Don't Give us everything in the Span of 5 Minutes. The Writer of this Film needed to keep those points more Subtle and ambiguous, so we can think about it after we've left the Cinema and say ""oh yeah, that's why he did this & that.....""Overall, I Loved the Production Design and Cinematography but Some of the Character Development and Motivations were Lacking and the Plotline lacked Subtlety when it needed it, and also Lacked Emphasis when it needed it."
"Saltburn","euroGary","9 October 2023",810,"Scouser student Oliver (Barry Keoghan, who is not English but Irish) arrives at Oxford University where he sticks out like a sore thumb (""he's a scholarship boy and buys his clothes from Oxfam"" sniffs one plummy-voiced deb). Despite this he attracts the attention of Home Counties aristocrat Felix (Jacob Elordi, who is not English but Australian/Spanish) who takes him to his family's country pile - the titular stately home - where Oliver meets Felix's family of stereotypical English aristos: vague mother, mad father, nymphomanic sister, American cousin (Archie Madekwe, who is not American but English/Nigerian/Swiss). At first even more out-of-place than he was at Oxford, Oliver quickly becomes used to life at Saltburn. But for how long will he be welcome there?Watching this at the 2023 London Film Festival, I found it reminded me of various other films: the obvious one is 'The Talented Mr Ripley' (1999), but there are also aspects of 'Wild Things' (1998) and 'The Riot Club' (2014). Despite this, 'Saltburn' does stand on its own two feet, principally because Oliver's motives are ambiguous and, unlike 'Ripley', there is a vein of comedy throughout (sometimes unintentionally: a scene of Oliver drinking bathwater into which Felix has just ejaculated had the audience falling about, but I am not sure that was the intention of writer/director/producer Emerald Fennell!) I also appreciated that Fennell avoids the reverse-discrimination trap of making rich folk exclusively nasty but instead shows that - hey! - aristocrats have feelings too! Felix, especially, is sympathetically-drawn. If I have any criticism it is that at over two hours the film is over-long - after the birthday party sequence it seems the film has reached a natural conclusion, although there is, it turns out, good reason for it to carry on... perhaps a few of the mid-way scenes could have been cut.The supporting players are gifted with enjoyable parts - standouts are Carey Mulligan as a drug-addled socialite and Paul Rhys (who, thirty years ago, would have been a natural to play Oliver) as a straight-laced butler. Those actors essaying accents not their own do a good job - Elordi's rich-boy drawl, in particular, is convincing. And as for leading man Keoghan - the lengthy sequence during which he dances nude to 'Murder on the Dance Floor' is likely to be one of the most-discussed scenes of the film."
"Saltburn","IHaveNoCommentToMake","8 January 2024",310,"Things we learned:1) The police force today has a similar detecting ability and use of technology as the 60s. It's surprisingly easy to get away with multiple murders.2) Big Stately homes don't have complicated lines of succession/inheritance.3) When someone starts acting bizarre for no apparent reason, that's a big turn on.4) Sucking bodily fluids from various orifices and surfaces is a really sound metaphor , great satire and not a substitute for character development.5] films are not derivative if they interlace scenes with good cinematography and some arty music. It is does not mask an incredibly shallow and dull plotted movie.6) the pay off can be obvious and on the nose as long as it does it to a quirky dance number naked a la American Psycho.7) wasting such enormous talents on such a banal and empty script is not a crime."
"Saltburn","malmevik77","22 November 2023",710,"SaltburnNow this was an interesting film. It's a mind game. It's manipulation. And it's nefarious. Be prepared to squirm Be prepared to gasp. Be prepared to say ""oh dear God"" a few times. The movie follows a very shy and quiet Oxford student on his quest to fit in. After a school year, he is invited to join his new friend at his family's enormous castle where we definitely see him in a fish out of water situation.Then things... happen. Oh boy do they happen. This is all I'm going to say but be prepared for a wild ride, and don't be squeamish. I enjoyed this, but it really deserves its R rating. It's very adult and highlights the depths human beings can go, regardless of material wealth.You know I love to find the human experience presented, possibly with a lesson in mental health awareness. Oh God no. Perhaps there is awareness, but there is no lesson.Rosamund Pike does steal the show. Her one liners are absolutely hilarious.Enjoy the ride."
"Saltburn","missaymoo92","6 January 2024",510,"I really don't understand why this movie is getting such rave reviews on here. Yes, it was very stylish, the music was great, and the acting was good. But the storyline was a HUGE disappointment. I kept waiting for something to happen, and when it finally did I was severely underwhelmed and disappointed that that was the direction the filmmakers went. It's overplayed, not creative or interesting. I saw the movie ""Parasite"" and I LOVED it. This movie just seemed like a cheap and trashy knock off with some bizarre scenes thrown in there for ""shock value"". Watch it if you want to see what all the buzz is about, but I'm just saying you might be left disappointed and wishing you would've spent 2.5 hours of your time on something else."
"Saltburn","snootsncoots","6 January 2024",310,"The acting and casting are terrific, but the character development leaves a lot to be desired. In its place we are given lots of gratuitous weird sex stuff.Take out the gratuitous sex stuff, and there's not much left. The plot has been done many times, and much better, especially in the old days of film noir where the character development added to the suspense.I'm sure certain types will call this art, but I call it lazy and pretentious. A plot this thin, especially with a very common story line, with such flimsy character development, would have been laughed out of any studio in better days."
"Saltburn","cathyannemoore-66196","22 December 2023",310,"I had greater expectations of this film given the combined talent of the cast. There are some very good actors in it but I suppose if the plot is no good there is nothing much they can do to elevate to watchable. Quick frankly it is barely watchable. Some really bizarre events occur that are neither funny nor scary. Just bewildering as for most of the film there is seemingly no real story or plot just interactions between some rather superficial characters. None of the characters including the leads are likeable. The plot is explained at the end but to be honest it's not worth watching to find out."
"Saltburn","tigerfish50","26 December 2023",310,"One has to assume 'Saltburn' was conceived as subversive satire or parody, but it's difficult to discern which it might be, since it possesses minimal sarcasm and humor. The copycat plot is derived from several sources - it initially follows the 'Brideshead Revisited' blueprint, relating how socially-challenged working class undergraduate Oliver Quick becomes friends with upper crust fellow collegian Felix at Oxford University. After a fairly shallow acquaintance, he's invited to spend the summer vacation with the latter's family at their stately home, Saltburn.The invitation is a mystery since Oliver is devoid of wit or allure, and upon arrival he's treated with universal condescension. The aristocratic clan are portrayed as eccentrics who would fit more comfortably in a farce - and they seem especially out of place when the story gallops off towards the territory of 'Kind Hearts and Coronets' and 'Talented Mr Ripley'. Oliver suddenly transforms from awkward dork into master manipulator - and it's another mystery how he accomplishes this, since he has no means to influence anybody. The other characters lack credibility in a similar way - and since everyone is tiresome and unpleasant, it's hard to maintain interest as the shadows deepen. Despite attempts to shock with some gratuitously distasteful episodes - concluding with a muddy bout of virtual necrophilia - this protracted tale becomes tedious long before its end."
"Saltburn","jeffdstockton","25 December 2023",110,"Baffled by the reviews here! This is a self-indulgent, unoriginal, poke in the eye, middle finger to the viewers piece of shallow trash.There are no interesting characters, no interesting events, no moments of insight, nothing whatsoever to make it worth one's time to watch this drivel.It is derivative of several other more original and thoughtful films & stories. There is almost no story here, actually. It is just little scenes of shallowness, one after the other. There are no surprises. The reveal at the end is completely devoid of surprise. The writer director seems to go for pruerient, lame attempts to shock, but nothing - NOTHING - is unexpected, nothing is surprising.And, there are no sympathetic characters at all. That can be OK on a well made - well written & well directed - film. But, this is not that film.This is shallow, ugly in spirit (because the writer/ director is deliberate in her meanness, callowness, shallowness and crude manipulation of viewers' generosity in given her (the director) their time and a level of confidence that they will be rewarded for watching.This is an absolute paper-thin crap movie, pretending to a higher-brow film. It's garbage. It will be deservedly tossed on the trash heap over time - not too long in it's run."
"Saltburn","lavatch","27 December 2023",110,"It must be observed that ""Saltburn"" is a vile and disgusting motion picture. The characters are unsympathetic, and their actions abhorrent with the bodily fluids flowing throughout this nauseating experience.The Catton family is depicted as an idle, hedonistic relic of the past that deserves to be picked off one-by-one with the implication that the British aristocracy belongs in the gutter. The beautiful Catton home includes detritus from the past such as Shakespeare's First Folio and paintings of Rubens that should be discarded along with the worn out Lords of England.The middle-class is also treated with utter contempt, as young Oliver is apparently so ashamed of his family that he informs his friends that his father is dead and is mother is a drunk. The parents are proud of their son. He wants them out of his life.Even the hallowed halls of The University of Oxford have lost any luster of the joy of learning. The single don that we meet in a tutorial has not even read the books on the students' reading list.This film will shortly be forgotten. But it leaves a record of a decadent, nihilistic era that has been stripped of the basic values of humanity and civilization."
"Saltburn","masonsaul","4 October 2023",910,"Emerald Fennell leaps over any potential sophomore slumps with Saltburn, an immensely twisted tale of obsession and excess that's black comedy eventually goes into much darker territory. It's bold, provocative and just so funny, buoyed by a cast who completely understand the assignment and deliver glorious results.Barry Keoghan gives a fearless performance, bearing all in more ways than one. His character is so fascinating, initially an audience surrogate that could've felt overly safe but his constant weaving in and out of control is a real highlight, making him so much more interesting and flawed.Jacob Elordi is enchanting, he's so kind without a single care in the world and one of the few seemingly nice people in Saltburn though not without his own self obsessed flaws. Rosamund Pike and Richard E. Grant dial it up to eleven and get some of the best laughs.Emerald Fennell and cinematographer Linus Sandgren craft a gorgeous film of vivid saturation and striking imagery (some of which cannot be unseen). Equally strong is Fennell's screenplay which is hilarious, almost every scene has at least one memorable joke or biting line of dialogue."
"Saltburn","justahunch-70549","24 December 2023",810,"I had been anxious to see this film due to the presence of Barry Keoghan as I found him fascinating in The Killing of a Sacred Deer and immensely entertaining in The Banshees of Inisherin, however the one thing I wasn't expecting was to see him in such an erotic role, but eroticism is the name of the game here and he plays it boldly and very well, to put it mildly. That's a good thing as he is front and center and in between at all times. I knew he was one of the leads in this, but I didn't know how much his role dominated the film. I've viewed this twice now and he is truly excellent. He plays innocent, backwards, funny, sexy, mysterious, sly, vile and evil all equally well. His presence and his performance is very fortunate as the film itself offers nothing terribly original in this Purple Noon/Mr. Ripley scenario, though the writing is witty and smart and there is nothing wrong with the rest of the cast either. They just don't have roles like he does! The object of his adoration is played by Jacob Elordi who does a good job here as does Rosamund Pike, Archie Madekwe and Carey Mulligan is a small, extremely funny role. As has been much discussed this does have a couple of rather outrageous scenes that might be upsetting to some, so those easily, or perhaps even those not so easily offended, might want to avoid this. As has also been much discussed Keoghan does have a rather extensive nude sequence. Besides the nudity, which he has nothing to be ashamed of, I'm not sure what to make of this scene. I can understand its existence, but I'm a little unclear as to why he sashays through it in the manner that he does. This is Emerald Fennell's second film as a director and while it hasn't received the acclaim of the first, Promising Young Woman, I did enjoy this more."
"Saltburn","CinemaSerf","8 October 2023",710,"I was quite nervous when I saw this. I was expecting a sort of hybrid of ""Another Country"" meets ""Brideshead Revisited"" as the story of ""Ollie"" (Barry Keoghan) and his aristocratic pal ""Felix"" (Jacob Elordi) unfolds. Both are at Oxford university, but the former man is very much a poor relation of his well-heeled contemporaries. One afternoon, though, he comes to the aid of ""Felix"" lending him his bike, and what now ensues is a friendship that sees the two gradually start to bond and for the latter to invite his new friend to his eponymous stately pile as a guest of his mother (Rosamund Pike) and father (Richard E. Grant). Tagging along throughout this experience is the slightly malevolent and jealous ""Farleigh"" (Archie Madekwe) as their summer vacillates from the hedonistic and enjoyable to the ghastly and tragic. It's a bit of a slow starter, but once we arrive at the ancestral pile the story starts to gather pace and ""Ollie"" proves to be quite adept at navigating - even manipulating - the frequently quite treacherous environment in which he finds himself. It is definitely too dialogue heavy, but Keoghan is good here and there is quite an effectively building degree of menace as we start to realise that maybe things aren't all quite what they seem. I found Madekwe also rather good as the odious hanger-on (only a posher one) and Carey Mulligan walks quite a characterful tightrope too. The photography and aesthetic of the film along with Anthony Willis's score all add a degree of richness to a story that isn't as derivative as I feared. I can't think it's a film I will remember in a few years, but it is well worth a watch as Mr Keoghan continues on his journey to what must be greater success."
