"title","username","date","stars","content"
"Saltburn","lavatch","27 December 2023",110,"It must be observed that ""Saltburn"" is a vile and disgusting motion picture. The characters are unsympathetic, and their actions abhorrent with the bodily fluids flowing throughout this nauseating experience.The Catton family is depicted as an idle, hedonistic relic of the past that deserves to be picked off one-by-one with the implication that the British aristocracy belongs in the gutter. The beautiful Catton home includes detritus from the past such as Shakespeare's First Folio and paintings of Rubens that should be discarded along with the worn out Lords of England.The middle-class is also treated with utter contempt, as young Oliver is apparently so ashamed of his family that he informs his friends that his father is dead and is mother is a drunk. The parents are proud of their son. He wants them out of his life.Even the hallowed halls of The University of Oxford have lost any luster of the joy of learning. The single don that we meet in a tutorial has not even read the books on the students' reading list.This film will shortly be forgotten. But it leaves a record of a decadent, nihilistic era that has been stripped of the basic values of humanity and civilization."
"Saltburn","masonsaul","4 October 2023",910,"Emerald Fennell leaps over any potential sophomore slumps with Saltburn, an immensely twisted tale of obsession and excess that's black comedy eventually goes into much darker territory. It's bold, provocative and just so funny, buoyed by a cast who completely understand the assignment and deliver glorious results.Barry Keoghan gives a fearless performance, bearing all in more ways than one. His character is so fascinating, initially an audience surrogate that could've felt overly safe but his constant weaving in and out of control is a real highlight, making him so much more interesting and flawed.Jacob Elordi is enchanting, he's so kind without a single care in the world and one of the few seemingly nice people in Saltburn though not without his own self obsessed flaws. Rosamund Pike and Richard E. Grant dial it up to eleven and get some of the best laughs.Emerald Fennell and cinematographer Linus Sandgren craft a gorgeous film of vivid saturation and striking imagery (some of which cannot be unseen). Equally strong is Fennell's screenplay which is hilarious, almost every scene has at least one memorable joke or biting line of dialogue."
"Saltburn","justahunch-70549","24 December 2023",810,"I had been anxious to see this film due to the presence of Barry Keoghan as I found him fascinating in The Killing of a Sacred Deer and immensely entertaining in The Banshees of Inisherin, however the one thing I wasn't expecting was to see him in such an erotic role, but eroticism is the name of the game here and he plays it boldly and very well, to put it mildly. That's a good thing as he is front and center and in between at all times. I knew he was one of the leads in this, but I didn't know how much his role dominated the film. I've viewed this twice now and he is truly excellent. He plays innocent, backwards, funny, sexy, mysterious, sly, vile and evil all equally well. His presence and his performance is very fortunate as the film itself offers nothing terribly original in this Purple Noon/Mr. Ripley scenario, though the writing is witty and smart and there is nothing wrong with the rest of the cast either. They just don't have roles like he does! The object of his adoration is played by Jacob Elordi who does a good job here as does Rosamund Pike, Archie Madekwe and Carey Mulligan is a small, extremely funny role. As has been much discussed this does have a couple of rather outrageous scenes that might be upsetting to some, so those easily, or perhaps even those not so easily offended, might want to avoid this. As has also been much discussed Keoghan does have a rather extensive nude sequence. Besides the nudity, which he has nothing to be ashamed of, I'm not sure what to make of this scene. I can understand its existence, but I'm a little unclear as to why he sashays through it in the manner that he does. This is Emerald Fennell's second film as a director and while it hasn't received the acclaim of the first, Promising Young Woman, I did enjoy this more."
"Saltburn","CinemaSerf","8 October 2023",710,"I was quite nervous when I saw this. I was expecting a sort of hybrid of ""Another Country"" meets ""Brideshead Revisited"" as the story of ""Ollie"" (Barry Keoghan) and his aristocratic pal ""Felix"" (Jacob Elordi) unfolds. Both are at Oxford university, but the former man is very much a poor relation of his well-heeled contemporaries. One afternoon, though, he comes to the aid of ""Felix"" lending him his bike, and what now ensues is a friendship that sees the two gradually start to bond and for the latter to invite his new friend to his eponymous stately pile as a guest of his mother (Rosamund Pike) and father (Richard E. Grant). Tagging along throughout this experience is the slightly malevolent and jealous ""Farleigh"" (Archie Madekwe) as their summer vacillates from the hedonistic and enjoyable to the ghastly and tragic. It's a bit of a slow starter, but once we arrive at the ancestral pile the story starts to gather pace and ""Ollie"" proves to be quite adept at navigating - even manipulating - the frequently quite treacherous environment in which he finds himself. It is definitely too dialogue heavy, but Keoghan is good here and there is quite an effectively building degree of menace as we start to realise that maybe things aren't all quite what they seem. I found Madekwe also rather good as the odious hanger-on (only a posher one) and Carey Mulligan walks quite a characterful tightrope too. The photography and aesthetic of the film along with Anthony Willis's score all add a degree of richness to a story that isn't as derivative as I feared. I can't think it's a film I will remember in a few years, but it is well worth a watch as Mr Keoghan continues on his journey to what must be greater success."
"Saltburn","Sleepin_Dragon","17 November 2023",910,"Oliver Quick becomes captivated by fellow student at Oxford, Felix. When Felix tells Oliver that his father has died, Felix invites Oliver back to his family home, the grand mansion estate of Saltburn.Imagine coming from a humble background, and being dropped into a world of luxury and abundance, where aristocrats live their lives detached from reality.This had me captivated from start to finish, truly one of the most unique and original films that I've seen for some time.The trailer captivated me, I had high expectations, if I'm honest, it exceeded my expectations. The writing oozed quality, great story, with some magnificent characters.At times it's bizarre, amusing, sexy and intriguing, and at times it's just plain weird. It simmers away for the most part, until the last fifteen minutes or so, when it transformation with a jaw dropping twist.Beautifully filmed, it looks amazing, some of the camera work is exquisite, and that building is simply glorious.The acting is first rate, Rosamund Pike, Richard E Grant and Carey Mulligan are all spot on, Barry Keoghan however, his performance deserves awards, that dance!! Won't forget that in a hurry.Loved it, and didn't want it to end.9/10."
"Saltburn","pkertes-59666","24 November 2023",410,"I liked Emerald Fennell's first feature, A Promising Young Woman, although it was a little left field and a touch disturbing. In this movie, she ramps up the disturbing with many scenes of repulsive behaviour which feel way too gratuitous - if the British aristocracy is really like this, the country is screwed.The plot is essentially that of A Talented Mr Ripley but the script is nowhere near as good and the narrative is often disjointed and at times boring. The directorial style is dark and gothic, but a bit inconsistent - some scenes are too long, some are pointless and the whole movie could have been 20-30 minutes shorter.There's occasional humour but it's offset by the depravity, which is really overdone. The acting is excellent however - Barry Keoghan plays the main character to perfection as an allegedly poor and lonely soul at Oxford who is desperate for the friendship of the handsome, popular and rich son of an eccentric aristocrat family. Rosamund Pike is also superb as the matriarch. A cameo by Carey Mulligan however is a complete waste of her talents.The plot twist towards the end was somewhat predictable so hardly a shock for a movie trying to sporadically shock you with depraved behaviour mixed in with efforts to parody the British upper class - but with not much class.If you like pretentious Arthouse films designed to shock the senses and you don't mind the disjointed script, then this movie might well be for you. But if you prefer to be allowed to concentrate on the unfolding tale of immorality without the shock and awe, then TTMR is a far better movie."
"Saltburn","LeBallz","22 November 2023",410,"They say write what you know. What I know is this is perhaps the most ironic film I've ever seen. Many people may not know the director Emerald Fennell comes from a very wealthy family, went to private school her entire life (including Oxford), and got her start due to those private school connections. To watch her send up upper class privilege as grotesque and distorted is bizarre in its own right but even more bizzare is she is selling her satire for money.The movie itself feels like a giant trope, more characature than human and almost cliche in its representation of money as all encompassing and all corrupting. My only theory is this film is mainly an apology from Fennell, trying to convince us she's one of the ""good"" privileged people for sending up the world she was raised in. But then I remember she's enriching herself by making this film, selling privilege to beget more privilege.If there was an award for ironic film of the year, this would win hands down."
"Saltburn","FONYMAHONEY","7 December 2023",510,"Emerald Fennell is a very very posh person. She's from extraordinary wealth. To take nothing away from her achievements as a filmmaker (Promising Young Woman was a terrific, difficult watch and rightly lauded) - but going in knowing that and then coming out the other side of this morally disturbing parable, it's a troubling setting and one that irks me.The two most obvious antagonists are the type of people you'd typically be rooting for in a film about rich vs poor, and the fact it's turned on its head doesn't feel like an innovative step - it feels like the exact opposite. It feels like someone from enormous privilege trying to redress the balance, almost like a propaganda piece.It's beautifully shot. It's really well acted. It's a solidly entertaining (if broadly unoriginal) little film, but as someone NOT from the world of Saltburn - it left a sour taste."
"Saltburn","M_Exchange","30 November 2023",610,"Yes, it's derivative, and yes, if you have even moderate familiarity with movies from the last few decades you will think ""The Talented Mr. Ripley"" fairly early during its runtime. However, for the most part, I enjoyed it. Barry Keoghan never disappoints me. Whether he is playing a suicidal dullard in ""The Banshees of Inisherin"" or a psychotic mastermind in this movie (and many other roles in between), he is always brilliant.For me, unfortunately its third act is probably its most memorable feature because it requires an enormous suspension of disbelief. Rosamund's Elspeth character invites Keoghan's Oliver character into her home yet again even though his history there is unbelievably dubious. She claimed that she felt guilty about his exile, but one wonders about her motives. Was she trying to have sex with him at that point? Rosamund Pike is an ageless, gorgeous woman, and her character had endless wealth--she didn't need an average-looking poor guy in her life. Also, why did she sign away her fortune to him so quickly? Was she not suspicious about her sudden illness with him in her life again? The butler, who observes everything obsessively, remained a presence there. Even if Elspeth took leave of her senses, wouldn't he intercede? The third act defies any sort of logic.But again, it was worth watching."
"Saltburn","mjw2305","8 January 2024",310,"There is a lot of hype about this movie, and a lot of talk about how some of the scenes are not for the feint hearted and that it is full of twists and turns. I was lured in for all the wrong reasons and knew very little else about Saltburn when I sat down to watch it.My score of 3 is entirely for the cast. I can't fault any of them. Sadly that is only positive I can draw from this awful film.The twists - I saw all of them coming, most are heavily contrived, and none felt shocking in the slightest.The 'not for the feint hearted' stuff - Sucking ejaculate from a draining bath plug, eating menstrual blood, having sex with a recently filled grave! It is all gratuitous and for shock value only. Yet, without these scenes there is literally nothing else going on.Saltburn is a seriously dull watch, the humour is barely present at all. I would have turned off after about an hour, but having got that far I stayed in hope of a clever ending. Nothing clever here, in fact, rather than clever they went for nonsensical. As if no one would suspect that the new guy would be behind all the deaths so he could get his hands on the estate.Boring journey, weak plot, dull twists, and gratuitous scenes do not make for a good watch.3/10 for the cast 0/10 for the film."
"Saltburn","ThatDoesntMatter","24 December 2023",NA,"I was willing to get involved in the story, but there was no story, just stuff happening, most of it unexplained, most of it silly and ridiculous, not shocking at all, just boring.I rewrote it in my head to make it make a little more sense, as the crumbs we are told and shown have so many holes they're sieves.He read about Saltburn, saw pictures, wanted to go there, yes, maybe already making plans to own it. THAT'S why he fixates on Felix (the 'happy'), recognising him for who he is. He wants to BE him, that's what the silly sexual stuff is about, unification, amalgamation with the desired natural born status, looks, etc.Thing is, this was all nothing. This was not a film about a psychopath, because that is shown in a 30 second collage towards the end, motivation never explained. Are we supposed to think it's jealousy? Bit lame. All we got up to that point is that he is a manipulator and a liar. The 'twist' is neither surprising nor shocking, it just takes you completely out of the film, because it's not gelled right. Several different movies and plotlines, and at the end it's an uninteresting mess.We are introduced to Oliver as a too straight nerd who wants to be part of the in-crowd. Okay, so we tag along, even believing that Felix likes him (because he's not a fanboy).As soon as we get to Saltburn the film loses credibility. Too much, too brash, too over-the-top, too silly, too boring.Story not told well, whatever it was. I sure don't care."
"Saltburn","brentsbulletinboard","9 December 2023",310,"Sometimes you come across a filmmaker whose works you just don't like. And now, after two features in, I can honestly say that about writer-director Emerald Fennell. I didn't care much for her debut outing, ""Promising Young Woman"" (2020), and I can say the same (and more) about her follow-up effort, ""Saltburn."" This alleged thriller about a seemingly awkward but quietly sinister Oxford student (Barry Keoghan) who ingratiates himself into a family of wealthy English aristocrats features a story and characters about whom, quite frankly, I couldn't care less. (Think ""The Killing of a Sacred Deer"" (2017) with a cast of eccentric old money cronies and a wolf in sheep's clothing.) This assemblage of utterly reprehensible characters living utterly reprehensible lives and zealously adhering to utterly reprehensible values fails to endanger viewer empathy, interest or even connection. Much of the narrative is predictable and glacially paced, incorporates sequences that are included for little more than forced shock value, features monodimensional and blatantly obvious (almost trite) character development, and frequently stumbles in attempts at humor that are wedged in largely for the sake of convenience or calculatedly timed comic relief. It's the kind of picture that prompts regular looks at one's watch to see how much more one must endure and delivers welcome sighs of relief when the end finally comes. What's more, given the combined talent pool for this production, it's a genuine shame to see the likes of Rosamund Pike, Carey Mulligan and Richard E. Grant relegated to supporting roles in which their abilities are sorely underused. And then there's the excessively hammy performance of Keoghan, who's quite obviously (and knowingly) acting and not disappearing into the bona fide portrayal of a character. In all, this offering feels like a picture that tries awfully hard to see how much it can get away with, especially when seeking to invoke dropped jaws among audience members, much as this director's cinematic predecessor attempted to do. Save your money, and don't waste your time on this vastly overrated release from a vastly overrated filmmaker."
"Saltburn","steveinadelaide","24 November 2023",510,"Saltburn, directed by Emerald Fennell (who brought us the excellent A Promising Young Woman), is a psychological thriller drama that attempts to navigate the maze-like world of the English aristocracy, but unfortunately, it loses its way. The film stars Barry Keoghan as Oliver Quick, a scholarship student at Oxford University, and Jacob Elordi as Felix Catton, a charming aristocrat who invites Oliver to spend a summer at his family's sprawling estate, Saltburn.Saltburn is set in the mid-2000s, a period marked by some economic and cultural decadence. It attempts to explore the clash of social classes, moral vacuity, and the seductions of wealth. However, the film's historical and cultural context feels superficial, failing to delve more deeply into the societal dynamics of the time. Despite being promising, the plot suffers from predictability and a lack of subtlety. The film tries to play with the idea of these enormous bastions of privilege and power as unique breeding grounds for strangeness, but it doesn't quite hit the mark. Forced and repetitive dialogues, which frequently feel artificial and contrived, further weaken the narrative.Despite having talented actors portraying them, the characters lack depth. Oliver, played by Keoghan, is a hateful, lustful, and envious character, but his portrayal is flat and uncomplicated. Felix, played by Elordi, is a character who comes from a life of blatant privilege, but his flimsy compassion does not seem real.Although Fennell's direction is bold, it lacks the dexterity required to make this intricate story come to life. The film's pacing is erratic; certain scenes seem rushed, while others drag on needlessly. The movie's soundtrack seems haphazard and does not improve the story. The movie also occasionally goes a bit too far in terms of taste and may have you cringing.The cinematography and production design are perhaps the film's strongest points. The grandeur of Saltburn, the sprawling estate, is captured beautifully, and the film does a commendable job of creating a lived-in feeling that feels glamorous and filthy at the same time. These artistic components, however, are insufficient to make up for the film's weak narrative.Saltburn is a film that promises much but delivers little. Despite its grand setting and talented cast, it fails to provide a compelling narrative or engaging characters. It's a film that tries to be a critique of the English aristocracy and a psychological thriller but falls short on both counts. While it may appeal to some viewers for its aesthetic appeal, it's a film that, unfortunately, doesn't live up to its potential. It's not a film I'd recommend."
"Saltburn","Laight","24 December 2023",210,"Take a bit of A Separate Peace, The Talented Mr. Ripley, Brideshead Revisited, Howards End and many more, mix them up into a rather incoherent story, and you get this over-the-top bit of fluff. The problems are too numerous to mention, but the most glaring is that there's not a tad of credibility in the set-up. Stories that involve someone of one class mixing it up with someone of another must show there's a connection between the two people: that part is completely skipped over here. There's no connection at all between the two major characters. The bond is never explained.Then there's the issue of character: no one in the film is a real person: all of them are pawns to serve the grand plot which, when dissected, falls apart. These aren't people; they're vehicles for the screenwriter (director, producer, etc) to show off an interesting but ultimately flawed story.So much else is wrong with this movie but to give them all away would be to contain spoilers, and the reviews that are most worthwhile here at IMDB are the ones that warn the reader off a show.Consider yourself warned."
