"title","username","date","stars","content"
"The Holdovers","bastille-852-731547","29 October 2023",610,"Set in December 1970, ""The Holdovers"" follows a small group of students who have to stay on campus over the Christmas break at Barton Academy (a prestigious boarding school in Massachusetts,) alongside a curmudgeonly ancient history teacher (Paul Giamatti.) That sounds like a potentially amusing premise for a breezy comedy-drama, especially when Alexander Payne is directing. Having greatly enjoyed and admired several of Payne's previous films such as ""Sideways,"" ""The Descendants,"" and ""Nebraska,"" I was looking forward to this film. Overall, I found it to be simply fine and not up to par with the level of quality of most of Payne's films. There's nothing too wrong with it by any stretch of the imagination, but it's often generic and forgettable compared to Payne's other films.An indie dramedy like this film would generally be expected to be defined by being character- and writing-driven. Unfortunately, neither the characters nor the writing here are especially unique enough to structure a compelling plot around. Paul (Giamatti's character) is very generic, as is the rebellious student Angus, whose relationship with Paul is a pivotal part of the film. On a better note, Da'Vine Joy Randolph gives a strong and impactful performance as Mary, a cafeteria worker dealing with bereavement; her character is interestingly more dynamic and multi-dimensional than either Paul or Angus. The writing and humor is less unique, funny, or engaging than many of Payne's films, as the attempts at plot devices, character development, and humor often boil down to insult comedy between Paul and Angus--which, ultimately, wears out its welcome a bit, and actually causes a bit of collateral damage in making the film's tone and story feel less sincere. Regardless of the sincerity of the story, another thing that is clear here is that there needed to be a stronger and less predictable core to the plot in order for the film to remain engaging for its 133-minute runtime.The film's retro, 1970s-aesthetic is commendable and helps contribute to the atmosphere of the film, and there still are some sporadic sweet moments of Paul and Mary hanging out around the television and a few decent jokes here and there. So ""The Holdovers"" is a fine enough film, but it won't be a new holiday classic for me. 6/10."
"The Holdovers","RahulM007","31 October 2023",1010,"""Penis cancer in human form.""Alexander Payne's ""The Holdovers"" is a laugh-out-loud comedy strengthened by Paul Giamatti and Dominic Sessa's magnetic performances and their incredible chemistry together. I am in awe by the film's brilliant and inventive screenplay, 70s-style cinematography, slick editing, and great production design. I could watch Paul and Angus bicker for another two hours. Throughout the film, the humour gets more interwoven leading to a crescendo of hilarity. ""The Holdovers"" offers the perfect blend of humor and pathos.*That waitress was so rude for refusing to accept their order of cherries jubilee. She is a fascist and a ""penis cancer in human form"".*The film reminded me of Peter Weir's ""Dead Poets Society"", Milos Forman's ""One Flew Over the Cuckoo's Nest"", and John Hughes' ""The Breakfast Club"" (kind of).Final verdict: 10/10."
"The Holdovers","Avwillfan89","29 November 2023",910,"Finally, Alexander Payne has made a worthy follow up to his (in my opinion at least) masterpiece Sideways.I really related so much to all three of the main characters, who all come from different backgrounds. Paul Giamatti, brilliant in almost anything he does, plays a grumpy, alcoholic, sour professor who does not suffer fools and doesn't cut his privileged students any slack. Dominic Sessa is troubled teen with a dysfunctional family and mental issues. D'Avine Joy Randolf is a grieving mother stuck in a job wanting to make ends meet for her family, by her choice.This movie has great character development, a wholesome story with flawed yet lovable characters you can root for and terrific, funny dialogue. Simple, yet perfect. 9 out of 10."
"The Holdovers","frankde-jong","27 December 2023",910,"I had a lot of associations when I started watching ""The holdovers"".Kids stuck in a school during the Christmas vacation, is that not a little bit like ""The breakfast club"" (1985, John Hughes)? No, because most of the kids go away early in the film and we are left with just one pupil (Angus Tully played by Dominic Sessa) and a teacher (Paul Hunham played by Paul Giamatti).Paul Hunham teaches ancient languages and culture. Does that sounds like the Donna Tartt novel ""The secret history"" (1992)? No, in that novel the pupils are inspired by their teacher. In ""The holdovers"" the teacher is hated.One association that I did not have at all prior to watching the movie may be the most accurate: ""Scent of a woman"" (1992, Martin Brest). Also in this film a high school pupil on an expensive boarding school and a grumpy old man are condemned to each other.Best of all however we can see ""The holdovers"" as the comeback of Alexander Payne after his failed film ""Downsizing"" (2017). The film is situated in 1970 and has a very 70's look and feel, down to the aspect ratio then used. The film also contains very beautiful images of Norteast American landscapes.First of all however the film is about its three main characters. Apart from the two already introduced we have the chief cook of the boarding school Mary Lamb (Da'Vine Joy Randolph). These three people form a sort of substitute family that has to spend the Christmas season together. Each of them has his/her problems but during the film they grow closer to each other, or at least learn to understand each other better.Being a Christmas movie you expect a happy ending and somewhere in the middle of the film this happy ending seems to consist of all the members of the proxy family being on their way towards an unexpected romance. The greatness of the film is that these romances do not materialize fully. The message of the film seems to be that gaining better understanding is a happy enough ending.By the way the film does not shy away from some social criticism. The character of Paul Hunham is meant to be grumpy at first, but to me he was instantly sympathetic when he made the headmaster of the boarding school very clear that in his class wealthy parents could not buy good grades for their sons. Later he says to his pupils (at that stage of the film there are still a couple of them) that they ought to be aware of their privileged status. ""You go to Harvard, poorer boys go to Vietnam"". The Vietnam war plays an important role in the background anyway. The son of the chief cook has died in Vietnam and while visiting a bar in the village nearby the boarding school there is a local boy that lost one of his hands in Vietnam.All in all ""The holdovers"" is a very convincing comeback of Alexander Payne. He made an instant Christmas classic!"
"The Holdovers","210west","14 January 2024",410,"Alexander Payne's 1999 comedy ""Election,"" set in a Midwestern high school, was brilliant, sometimes painful, sometimes hilarious. Best of all (I say this as a onetime high school teacher), it felt refreshingly authentic.""The Holdovers"" is quite the opposite: contrived, predictable, and intended to teach -- you guessed it -- a little lesson in compassion. An hour into it, I realized that it hadn't yet contained a single moment that seemed genuine, much less surprising. Every line of dialogue sounds phony. Characters speak in little announcements, spelling things out for us. Some of the characters -- a couple of menacing townies, for example -- are mere cartoons.Giamatti's protagonist is a wholly artificial creation, designed as if in a screenwriting course to follow the approved character arc -- initially stuffy and unsympathetic to the point of caricature, ultimately vulnerable. Ironically, an early scene between him and the school's headmaster violates what's sometimes regarded as a screenwriting rule: Do NOT, even in the interest of exposition, have people telling each other what they already know. (The by-the-numbers triteness of that conversation -- meant to show us that the instructor is uncompromising and pedantic but possesses old-fashioned integrity, blah blah blah -- put me off from the start.) The scenes between Giamatti and the school's cook -- in which, with the audience in mind, the two provide personal backstories and reveal their inner selves -- are painfully heavy-handed and at times so gooey that I felt sorry for the actress: ""You can't even dream a whole dream, can you?"" she is made to say at one point. ""What are you afraid of?""Yes, I know, everybody seems to love the movie. I could barely stomach it. But do check out ""Election."""
"The Holdovers","bdesdes","30 October 2023",810,"Very enjoyable film with outstanding performances and a wonderful warm vibe accompanied by the Christmas season. It's funny at times, sad at times, and feel-good. It's a story that almost all can relate to and will really touch your heart. It deals with so many themes, but mainly grief, the past, family, and what makes a person who they are. It's also very original and has a great script, cinematography, and soundtrack. I would highly advise to see it in the theaters as well as you really get the 70's vibe and deep moment on the big screen. There aren't many negatives to this film and I would recommend it to most people."
"The Holdovers","aharmas","29 October 2023",1010,"Here is a film that feels and looks like something out of the early seventies. The Holdovers is a strong and warm-hearted piece that gives actors roles with powerful lines, without any reliance on flashy editing and being overwhelmed by special effects.The story is simple three people get stuck for the Christmas holidays in a boarding school. It's cold, lonely, and boring for the parties involved. The adults drink to cope with whatever pressures they live with. The young man resorts to bad behavior and altercations with the teacher in charge.Through the vacation period these people will get to interact and get to know each other, something that will prove to a challenge to say the least. As the story evolves, we get to understand what has made the people who they are. We get to feel their pain and frustration through the very insightful writing of the director.It's a strong film with superb acting by the main leads. They have great chemistry together.Most outstanding is Paul Giamatti who plays the tormented and defensive man with relish and speaks volumes with his eyes.Hope the academy honors his performance as the best the year because no one else so far is coming close."
"The Holdovers","darkreignn","29 October 2023",910,"Let's just get this out of the way now - when it comes to writing this review, I'm probably a little bit biased (and a little bit drunk, currently, but that's besides the point). You see, I have an affinity for indie coming of age movies, and ""The Holdovers"" is basically an indie coming of age film, so it may - or may not - come as a surprise to you that I absolutely adored this picture. So, with that little preface out of the way, it's time for me to gush over this movie.Starring none other than Paul Giamatti as Paul Hunham, Giamatti plays a professor at an all boys boarding school where, over Christmas break, he has the misfortune of looking over a group of boys, one of whom is named Angus, played by Dominic Sessa. After a rocky start, where Paul clearly doesn't get along with any of the boys, making his disdain clear and evident, he eventually finds himself alone with Angus - as well as with the school's cook, Mary Lamb, played by Da'Vine Joy Randolph - in an unexpected chain of events. What occurs after is a slice-of-life style piece of cinema that allows broken people to find comfort in each other's company.""The Holdovers"" is, without a doubt, one of my favorite movies of 2023, as well as probably one of the best movies of the year, as well. This Christmas-themed gem doesn't hold back on the drama, delivering a thoughtful blend of comedy, coming-of-age storytelling, and a touch of romance - all wrapped around a very raw, human plot-line that virtually everyone can relate to. I'm no spring chicken myself, but I found myself deeply connected to both main characters - one who is older and basically dejected with life as he knows it, and one who is younger but who feels lost, aimless, and disconnected from both family and friends. And admittedly, not everyone will have a direct parallel to these experiences, but even if you don't, you're in for a story that's bound to tug at your heartstrings... and make you laugh out loud in the process.This is a high-quality movie - from the impeccable acting to the beautiful on-location cinematography to the relatable, thought-provoking plot, every element is executed with pinpoint precision and finesse; it's a testament to the art of storytelling on the silver screen. Director Alexander Payne knows how to create an artful film, and ""The Holdovers"" is no exception. It's at once indie and art-house while simultaneously being mainstream and easily accessible; in short, it's a film for everyone that actually feels like a genuine crowdpleaser instead of a pandering mess.I'm having a difficult time describing what I liked about this movie, and the reason is because I liked almost everything about this movie. So why the 9 out of 10 rating instead of the perfect 10? Literally the only thing that's holding me back is because I would've liked a touch more romance; yes, there was romance here, but a bit more would've pushed me over the edge into 10 out of 10 territory. Besides that, this is basically a perfect film, one that I loved, and one that has become one of my favorite movies of the year, if not of all time. I am genuinely looking forward to rewatching this, and I can't wait until it becomes closer to Christmas so I can view this on my own TV, cuddled under blankets, with a glass of whiskey, and bask in the absolute heartwarming experience that is ""The Holdovers."" My recommendation: Do yourself a favor and watch this as soon as you can - you won't regret it."
"The Holdovers","evanston_dad","20 November 2023",1010,"Mid-way through ""The Holdovers,"" I started openly weeping in the movie theater, and I pretty much kept it up on and off for the rest of the movie. Sometimes, there wasn't even anything obviously sad or moving happening in the scene, and I still couldn't stop. I think it's because this movie is so kind, and kindness is a rare commodity these days. It's sad to think that a movie about characters learning to have compassion for each other and for the hardships they've been through should feel like such a rare beast, but here we are.This is Alexander Payne firing on all cylinders as a director, and though he didn't write this movie, it feels like he could have. It's an obvious throwback to the kinds of movies Hal Ashby made throughout the 1970s and is touching in exactly the same way ""Harold and Maude"" was. It's also a master class in acting from the three principal characters played by Paul Giamatti, Dominic Sessa, and Da 'Vine Joy Randolph, and I hope all three of them, and the movie overall, is remembered come Oscar time.This will easily make my top ten list for the year.Grade: A+"
"The Holdovers","Xstal","28 November 2023",810,"Now here's a film with a life affirming theme, that should encourage most viewers to think of their dreams, and cascade away all their cloaks, inhibitions, and open fresh doors to their heart's intuitions; as a teacher whose life is as stale as dead fish, whose life is the opposite of happy and bliss, meets a boy who's ignored by all those he holds dear, and a friendship is formed that is warm and sincere; it's a subtle reflection of how we get trapped, by tradition and habits and past circumstance, where surroundings like prisons can temper our thinking, to distil all our spirit, to bottles for drinking; so embrace all the chances when they come along, break out of that mould and sing your own song, open your eyes to the paths unexplored, take a stand and stand tall, and stop being ignored."
"The Holdovers","steiner-sam","10 November 2023",910,"It's a comedy-drama set from December 16, 1970, to the first week of January 1971 in an exclusive boy's boarding school in New England and Boston, Massachusetts. It follows the experiences of the ""holdovers,"" that is, the students who cannot go home over the Christmas holidays and the two Barton staff left to supervise them during the holidays.There are five holdovers: Teddy Kountze (Brady Hepner), Jason Smith (Michael Provost), and Angus Tully (Dominic Sessa) are upper-class wealthy WASP students. Alex Ollerman (Ian Dolley) is a younger Mormon student whose parents are on a mission in South America. Ye-Joon Park (Jim Kaplan) is from South Korea.Left to supervise is Paul Hunham (Paul Giamatti), an unmarried ancient history teacher who was once a student at Barton and has taught there all his career. He's a demanding curmudgeon who almost everyone dislikes. African American Mary Lamb (Da'Vine Joy Randolph), the head cook, is also present; her son, a Barton grad, has just been killed in Vietnam.The film follows the shared experiences of the holdovers, though four students leave after a week when a wealthy father takes them for a ski holiday. Paul cannot contact Angus's parents, so he must stay with Paul and Mary at Barton. We also meet the school's headmaster, Hardy Woodrup (Andrew Garman), his administrative assistant, Lydia Crane (Carrie Preston), and janitor Danny (Naheem Garcia).""The Holdovers"" is a delightful comedy leavened with wisdom as we learn the dark secrets that have shaped Paul Hunham and Angus Tully. Giamatti, Sessa, and Randolph are all excellent. The script unfolds the twists and turns superbly. ""The Holdovers"" is a great Christmas movie."
"The Holdovers","JohnDeSando","16 November 2023",NA,"""I find the world a bitter and complicated place. And it seems to feel the same way about me."" Paul Hunham (Paul Giamatti)Teaching privileged boys at an elite new England prep school called Barton (think for example, Philips Exeter), might be the pinnacle of an academic's career. But not Paul Hunham in The Holdovers, an elite movie itself of the year.Paul should be teaching classics at an ivy school, not teaching entitled ""vermin,"" among the many sobriquets he tosses around about the fortunate young men to experience his brand of grumpy intellectualism and misanthropy. He prepares them for a world that won't always be coddling and protecting them as their family wealth so naturally does in their early years.Director Alexander Payne worked with Giamatti in Sideways, so he is prepared to have another winning cynical character who is endearing while distanced by negative temperament from normally positive fellow humans (Paul's last name, Hunham, suggests a distant connection with the better angels of humanity).As Paul accepts the assignment to supervise holdovers (exiled to Christmas vacation in the absence of parents or guardians), the number whittles down to just Angus Tully (Dominic Sessa, reminiscent of young, Timothy Chalamet and Adam Driver), who shares Paul's dark attitudes and, with the sharp writing of David Hemingson, some witty dialogue- e.g., about Paul he says, ""I thought all of the Nazis had left for Argentina.""Although, as in likeminded dramas such as Dead Poet's Society or Goodbye, Mr. Chips, the principals are destined to be transformed into more humane characters, Holdovers continues, even in its denouement, to accentuate the unsunny side of life for Paul and Tully, whose fortunes are still compromised by cold-hearted parents and administrators. The chilly world, however, is warmed on these lovely, snowbound days, by women, viz., the cook, Mary (Da'Vine Joy Randolph) and administrator Lydia (Carrie Preston).Mary good-naturedly deals with the death of her son, Curtis, a Barton grad who had to join the military because he did not have the resources as other Barton grads of the late '60s did to avoid the draft.Lydia, an attractive middle-aged staff member, holds the promise of a love interest for Paul, only to show how difficult it is for social exiles to enter the romantic mainstream.The Holdovers is a small gem of a move that will immediately remind buffs about Hal Ashby comedies of the same era like Harold & Maude, where character development is paramount and detachment from the mainstream is required to look at humanity clearly with its foibles and endearments.The Holdovers is a movie everyone can enjoy with endearing characters who share with us our moments about loneliness peppered with the possibilities of love and happiness.""Do you think I want to be babysitting you? No. I was praying your mother would pick up the phone, or your father would arrive in a helicopter or a flying saucer...."" Paul Hunham."
"The Holdovers","dtswpod","6 November 2023",810,"Do you miss how they used to make films in the 1970s? Plenty of filmmakers do, except they take that nostalgia and just do watered down versions of better movies. As an example see Taxi Driver and King of Comedy then watch Joker and you'll get what I mean.Thankfully, Alexander Payne has managed to take his sentimentality and make an original film out of it. Or if The Holdovers is a pale imitation of a superior picture then the filmmaker has managed to trick me because I don't feel as if I've seen this movie before but done better.Now to be clear, there aren't things you've never seen before in the movie. I mean, you know the characters are going to bond at some point. And people will grow to care about each other. That's a given. How we get there, however, is what makes the film seem fresh and entertaining and ever bit as good as any flick made back in the day.I hope more people see it."
"The Holdovers","tdwillis-26273","7 December 2023",810,"Finally......a GOOD movie. The story/script, although not a breakthrough idea, was heartfelt,full and real.The settings were also real and gorgeous (not really a cgi fan)
Camera, cinematography, lighting,sound,score....every level made my eyes and ears satisfyingly full.Acting was oscarworthy across the board.Directing was brilliant.Only negative I can come up with is that the pace was a bit slow, but so much of the movie is so focused and so superbly and beautifully made I just sat back and enjoyed it.A very thoughtful substantial and beautiful movie. A rare gem in today's superficial gimmicky movie making world."
